{
  "id": "generic-signed-amount",
  "version": "1.0.0",
  "display_name": "Generic: single signed amount column",
  "description": "For exports with one amount column holding positive (credit) and negative (debit) values, e.g. importe/monto/amount.",
  "supported_formats": ["csv", "xlsx"],
  "locales": ["en", "es"],
  "expected_headers": ["amount"],
  "header_aliases": {},
  "rows_to_skip": 0,
  "footer_patterns": [],
  "date_formats": [],
  "decimal_separator": null,
  "thousands_separator": null,
  "transaction_order": "auto",
  "currency": null,
  "amount_mode": "signed",
  "date_column": null,
  "debit_column": null,
  "credit_column": null,
  "signed_amount_column": null,
  "balance_column": null,
  "reference_column": null,
  "description_column": null,
  "currency_column": null,
  "account_column": null,
  "account_masking_rules": { "min_digits": 6, "keep_last": 4 },
  "detection_priority": 40
}
