{
  "id": "generic-debit-credit",
  "version": "1.0.0",
  "display_name": "Generic: separate debit/credit columns",
  "description": "For exports with separate debit and credit columns (cargo/abono, debe/haber, withdrawal/deposit). Debits become negative canonical amounts, credits positive.",
  "supported_formats": ["csv", "xlsx"],
  "locales": ["en", "es"],
  "expected_headers": ["debit", "credit"],
  "header_aliases": {},
  "rows_to_skip": 0,
  "footer_patterns": [],
  "date_formats": [],
  "decimal_separator": null,
  "thousands_separator": null,
  "transaction_order": "auto",
  "currency": null,
  "amount_mode": "debit_credit",
  "date_column": null,
  "debit_column": null,
  "credit_column": null,
  "signed_amount_column": null,
  "balance_column": null,
  "reference_column": null,
  "description_column": null,
  "currency_column": null,
  "account_column": null,
  "account_masking_rules": { "min_digits": 6, "keep_last": 4 },
  "detection_priority": 50
}
